[
  {
    "id": "static-shot",
    "name": "Static shot",
    "category": "Pan/Tilt",
    "description": "Locked-off frame — no camera movement at all.",
    "prompt": "locked-off static shot. Movement: hold one fixed camera position for the full clip. Speed: still and steady. Framing: keep the same angle, height, lens distance and composition. End: finish with the same framing and camera position.",
    "prompt_template": "{scene}. Camera: locked-off static shot. Movement: hold one fixed camera position for the full clip. Speed: still and steady. Framing: keep the same angle, height, lens distance and composition. End: finish with the same framing and camera position.",
    "best_for": "Dialogue holds, tableaux, and moments that need calm and control.",
    "tips": [
      "Let the subject carry the motion: a gesture, breath, wind in hair or drifting smoke.",
      "Say \"the camera does not move\" once more at the end of the prompt if the model keeps drifting."
    ],
    "negatives": [
      "camera movement",
      "zoom",
      "pan",
      "tilt",
      "camera shake",
      "handheld sway"
    ],
    "recommended_duration_min_s": 4,
    "recommended_duration_max_s": 6,
    "dramatic": false,
    "example_clip_url": "https://assets.fxi.studio/generations/88220018-910b-46f4-a258-4314f5d58046/cinecam/static-shot-v7.mp4",
    "example_clip_webm_url": "https://assets.fxi.studio/generations/88220018-910b-46f4-a258-4314f5d58046/cinecam/static-shot-v7.webm",
    "poster_url": "https://assets.fxi.studio/generations/88220018-910b-46f4-a258-4314f5d58046/cinecam/static-shot-v7.jpg",
    "example_clip_duration_s": 4.88,
    "example_clip_width": 1280,
    "example_clip_height": 720,
    "tutorial_url": "https://www.fxi.studio/tutorials/prompt-recipes/static-shot?utm_source=github&utm_medium=oss&utm_campaign=camera-moves&utm_content=dataset"
  },
  {
    "id": "pan-right",
    "name": "Pan right",
    "category": "Pan/Tilt",
    "description": "Horizontal rotation left-to-right from a fixed point.",
    "prompt": "pan right. Movement: rotate the camera horizontally from left to right from one fixed point. Speed: smooth constant rotation. Framing: keep the horizon level while new space enters from the right side of the frame. End: settle on a clear final composition.",
    "prompt_template": "{scene}. Camera: pan right. Movement: rotate the camera horizontally from left to right from one fixed point. Speed: smooth constant rotation. Framing: keep the horizon level while new space enters from the right side of the frame. End: settle on a clear final composition.",
    "best_for": "Revealing a landscape or handing off to a subject entering frame right.",
    "tips": [
      "Start the frame with open space on the right so the pan has something to reveal.",
      "Keep the pan under half a turn per clip; wide sweeps smear detail."
    ],
    "negatives": [
      "tilt",
      "zoom",
      "camera shake",
      "tilted horizon",
      "dolly movement"
    ],
    "recommended_duration_min_s": 4,
    "recommended_duration_max_s": 6,
    "dramatic": false,
    "example_clip_url": "https://assets.fxi.studio/generations/88220018-910b-46f4-a258-4314f5d58046/cinecam/pan-right-v7.mp4",
    "example_clip_webm_url": "https://assets.fxi.studio/generations/88220018-910b-46f4-a258-4314f5d58046/cinecam/pan-right-v7.webm",
    "poster_url": "https://assets.fxi.studio/generations/88220018-910b-46f4-a258-4314f5d58046/cinecam/pan-right-v7.jpg",
    "example_clip_duration_s": 4.88,
    "example_clip_width": 1280,
    "example_clip_height": 720,
    "tutorial_url": "https://www.fxi.studio/tutorials/prompt-recipes/pan-right?utm_source=github&utm_medium=oss&utm_campaign=camera-moves&utm_content=dataset"
  },
  {
    "id": "pan-left",
    "name": "Pan left",
    "category": "Pan/Tilt",
    "description": "Horizontal rotation right-to-left from a fixed point.",
    "prompt": "pan left. Movement: rotate the camera horizontally from right to left from one fixed point. Speed: smooth constant rotation. Framing: keep the horizon level while new space enters from the left side of the frame. End: settle on a clear final composition.",
    "prompt_template": "{scene}. Camera: pan left. Movement: rotate the camera horizontally from right to left from one fixed point. Speed: smooth constant rotation. Framing: keep the horizon level while new space enters from the left side of the frame. End: settle on a clear final composition.",
    "best_for": "Following a subject moving left or unveiling a reveal to frame left.",
    "tips": [
      "Start the frame with open space on the left so the pan has something to reveal.",
      "Keep the pan under half a turn per clip; wide sweeps smear detail."
    ],
    "negatives": [
      "tilt",
      "zoom",
      "camera shake",
      "tilted horizon",
      "dolly movement"
    ],
    "recommended_duration_min_s": 4,
    "recommended_duration_max_s": 6,
    "dramatic": false,
    "example_clip_url": "https://assets.fxi.studio/generations/88220018-910b-46f4-a258-4314f5d58046/cinecam/pan-left-v7.mp4",
    "example_clip_webm_url": "https://assets.fxi.studio/generations/88220018-910b-46f4-a258-4314f5d58046/cinecam/pan-left-v7.webm",
    "poster_url": "https://assets.fxi.studio/generations/88220018-910b-46f4-a258-4314f5d58046/cinecam/pan-left-v7.jpg",
    "example_clip_duration_s": 4.88,
    "example_clip_width": 1280,
    "example_clip_height": 720,
    "tutorial_url": "https://www.fxi.studio/tutorials/prompt-recipes/pan-left?utm_source=github&utm_medium=oss&utm_campaign=camera-moves&utm_content=dataset"
  },
  {
    "id": "whip-pan-right",
    "name": "Whip pan right",
    "category": "Pan/Tilt",
    "description": "Fast snap rotation to the right with motion blur.",
    "prompt": "whip pan right. Movement: rotate rapidly from the starting direction toward a new target on the right. Speed: fast snap with brief motion blur during the rotation. Framing: begin on one readable composition and land on a second readable target. End: settle into a sharp final frame.",
    "prompt_template": "{scene}. Camera: whip pan right. Movement: rotate rapidly from the starting direction toward a new target on the right. Speed: fast snap with brief motion blur during the rotation. Framing: begin on one readable composition and land on a second readable target. End: settle into a sharp final frame.",
    "best_for": "Energetic scene transitions and connecting two beats with a blur cut.",
    "tips": [
      "Name the landing target (\"land on the open doorway on the right\") so the clip ends on something readable.",
      "Cut out of the blur, or chain the next clip from the settled last frame."
    ],
    "negatives": [
      "slow pan",
      "zoom",
      "blur on the final frame",
      "multiple whip pans",
      "tilt"
    ],
    "recommended_duration_min_s": 2,
    "recommended_duration_max_s": 4,
    "dramatic": true,
    "example_clip_url": "https://assets.fxi.studio/generations/88220018-910b-46f4-a258-4314f5d58046/cinecam/whip-pan-right-v7.mp4",
    "example_clip_webm_url": "https://assets.fxi.studio/generations/88220018-910b-46f4-a258-4314f5d58046/cinecam/whip-pan-right-v7.webm",
    "poster_url": "https://assets.fxi.studio/generations/88220018-910b-46f4-a258-4314f5d58046/cinecam/whip-pan-right-v7.jpg",
    "example_clip_duration_s": 4.88,
    "example_clip_width": 1280,
    "example_clip_height": 720,
    "tutorial_url": "https://www.fxi.studio/tutorials/prompt-recipes/whip-pan-right?utm_source=github&utm_medium=oss&utm_campaign=camera-moves&utm_content=dataset"
  },
  {
    "id": "whip-pan-left",
    "name": "Whip pan left",
    "category": "Pan/Tilt",
    "description": "Fast snap rotation to the left with motion blur.",
    "prompt": "whip pan left. Movement: rotate rapidly from the starting direction toward a new target on the left. Speed: fast snap with brief motion blur during the rotation. Framing: begin on one readable composition and land on a second readable target. End: settle into a sharp final frame.",
    "prompt_template": "{scene}. Camera: whip pan left. Movement: rotate rapidly from the starting direction toward a new target on the left. Speed: fast snap with brief motion blur during the rotation. Framing: begin on one readable composition and land on a second readable target. End: settle into a sharp final frame.",
    "best_for": "Energetic scene transitions and connecting two beats with a blur cut.",
    "tips": [
      "Name the landing target (\"land on the window on the left\") so the clip ends on something readable.",
      "Cut out of the blur, or chain the next clip from the settled last frame."
    ],
    "negatives": [
      "slow pan",
      "zoom",
      "blur on the final frame",
      "multiple whip pans",
      "tilt"
    ],
    "recommended_duration_min_s": 2,
    "recommended_duration_max_s": 4,
    "dramatic": true,
    "example_clip_url": "https://assets.fxi.studio/generations/88220018-910b-46f4-a258-4314f5d58046/cinecam/whip-pan-left-v7.mp4",
    "example_clip_webm_url": "https://assets.fxi.studio/generations/88220018-910b-46f4-a258-4314f5d58046/cinecam/whip-pan-left-v7.webm",
    "poster_url": "https://assets.fxi.studio/generations/88220018-910b-46f4-a258-4314f5d58046/cinecam/whip-pan-left-v7.jpg",
    "example_clip_duration_s": 5.83,
    "example_clip_width": 1280,
    "example_clip_height": 720,
    "tutorial_url": "https://www.fxi.studio/tutorials/prompt-recipes/whip-pan-left?utm_source=github&utm_medium=oss&utm_campaign=camera-moves&utm_content=dataset"
  },
  {
    "id": "tilt-up",
    "name": "Tilt up",
    "category": "Pan/Tilt",
    "description": "Vertical rotation upward from a fixed point.",
    "prompt": "tilt up. Movement: rotate the camera upward from one fixed point. Speed: smooth constant tilt. Framing: keep the vertical subject or architecture centered as the frame travels upward. End: land on the upper target.",